{
  "schema_version": "0.1",
  "mission_id": "demo-024",
  "objective": "Fix the checkout regression in the fixture project",
  "location": "cloud",
  "budget_units": 200,
  "input_manifest": [
    "src/checkout.ts",
    "tests/checkout.test.ts",
    "package-lock.json"
  ],
  "success_checks": [
    "existing regression suite passes",
    "independent checkout fixture passes"
  ]
}
